Simples & Natural - Grãos e Castanhas,"R. Frei Gaspar, 40 - Vila Santa Rita de Cassia, São Bernardo do Campo - SP, 09720-440, Brazil"
Nutty Bavarian,"Praça Samuel Sabatini, 200 - Centro, São Bernardo do Campo - SP, 09750-700, Brazil"
Noz do Brasil - Produtos Naturais - Vila Prudente SP,"R. Amparo, 453 - Vila Prudente, São Paulo - SP, 03151-060, Brazil"
Nutty Bavarian,"Av. Pereira Barreto, 42 - Vila Boa Vista, Santo André - SP, 09190-210, Brazil"
Nutty Bavarian,"Pinheiros, São Paulo - State of São Paulo, 05402-600, Brazil"
Nutty Up,"Grande Plaza Shopping - Av. Industrial, 600 - Tamanduateí 3, Santo André - SP, 09080-510, Brazil"
Empório das Castanhas,"R. Carlos Sampaio, 331 - Bela Vista, São Paulo - SP, 01333-021, Brazil"
M.J. Doces E Castanhas,"R. dos Calangos - Parque Doroteia, São Paulo - SP, 04474-270, Brazil"
Supermercado Castanha,"Praça Santa Edwiges, 29 - Remédios, São Paulo - SP, 05104-005, Brazil"
Pedro das Castanhas,"R. Dr. Roberto Feijó, 143 - Parque da Vila Prudente, São Paulo - SP, 03138-000, Brazil"
Empório das Castanhas,"Rua Amália de Noronha, 329 - Pinheiros, São Paulo - SP, 05410-010, Brazil"
Empório Zanata,"Mercado Municipal - Av. Caminho do Mar, 3344 - Loja 27 - Rudge Ramos, São Bernardo do Campo - SP, 09612-000, Brazil"
Nutty Bavarian,"Av. Washington Luís, s/nº - Vila Congonhas, São Paulo - SP, 04626-911, Brazil"
Mercadão Natural,"Alameda dos Nhambiquaras, 1413 - Moema, São Paulo - SP, 04090-012, Brazil"
EMPÓRIO SETE MESTRES,"R. Wadia Jafete Assad, 245 - Dos Casa, São Bernardo do Campo - SP, 09850-090, Brazil"
Empório Santa Castanha,"R. da Cantareira, 306 - Rua G, Box 16 - Luz, São Paulo - SP, 01024-000, Brazil"
Armazém Paes e Paes Zona Cerealista do ABC,"R. Joaquim Távora, 271 - Vila Santa Teresa, Santo André - SP, 09030-390, Brazil"
Nutty Bavarian,"Ibirapuera Park - Vila Mariana, São Paulo - SP, 04094-050, Brazil"
Nutty Bavarian,"RAMOV - Av. Aricanduva, 5555 - Vila Matilde, São Paulo - SP, 03527-900, Brazil"
"Brazilian Nuts - Açaí, sucos e castanhas - Vila Madalena, São Paulo","R. Fradique Coutinho, 1002 - Vila Madalena, São Paulo - SP, 05416-001, Brazil"
Noz do Brasil - Produtos Naturais - Vila Prudente SP,"R. Amparo, 453 - Vila Prudente, São Paulo - SP, 03151-060, Brazil"
Macadâmia Cerealista LTDA,"Praça Dr. Policarpo de Magalhães Viotti, 19 - Parque Mandaqui, São Paulo - SP, 02422-000, Brazil"
Macadâmia Bolsas Showroom,"R. Boa Vista, 254 - Centro Histórico de São Paulo, São Paulo - SP, 01202-001, Brazil"
MACADÂMIA MERCADO SAUDÁVEL,"Av. Morumbi, 7849 - Santo Amaro, São Paulo - SP, 04703-003, Brazil"
Macadâmia Home,"Alameda Gabriel Monteiro da Silva, 1308 - Jardim Paulistano, São Paulo - SP, 01442-000, Brazil"
Macadâmia moda feminina,"R. Alfredo Pujol, 111 - Santana, São Paulo - SP, 02017-010, Brazil"
Mr. Cheney - Cookies,"Av. Kennedy, 700 - Conj. 115A - Jardim do Mar, São Bernardo do Campo - SP, 09726-253, Brazil"
Macadamia Cabelo e Estética,"R. Barão de Jaceguai, 1631 - Centro, Mogi das Cruzes - SP, 08780-100, Brazil"
Biscoitê A Biscoiteira,"Praça Samuel Sabatini, 200 - Centro, São Bernardo do Campo - SP, 09750-902, Brazil"
Dadiva Natural - Loja de Produtos Naturais Santo André,"R. Carijós, 2060 - Vila Linda, Santo André - SP, 09180-001, Brazil"
Macadâmia Bela Vista,"Rod. Eng. Constâncio Cintra, Km 113,5 - Amparo, SP, 13900-000, Brazil"
Restaurante Bananeira,"R. Mal. Hastimphilo de Moura, 419 - Morumbi, São Paulo - SP, 05641-000, Brazil"
Pecan Restaurante - Shop. Paineiras,"Av. 9 de Julho, 1155 - Pte. de Campinas, Jundiaí - SP, 13209-090, Brazil"
Residencial Pecan,"Via Paulo Leone, 1845 - V Medeiros, Itupeva - SP, 13296-432, Brazil"
Pecan Móveis Planejados,"Av. Intercontinental, 855 - Jardim Caner, Taboão da Serra - SP, 06753-000, Brazil"
Loteamento Fechado Pecan (Lotes a partir de 360 M2),"Via Paulo Leone, 1845 - Pinheirinho, Itupeva - SP, 13295-000, Brazil"
Pecan Store,"Alameda Itapecuru, 515 - Alphaville, Barueri - SP, 06454-080, Brazil"
Caju,"Caju, Rio de Janeiro - State of Rio de Janeiro, Brazil"
Caju Bar,"Torre Hotel - Av. das Nações Unidas, 14401 - Vila Sao Francisco (Zona Sul), São Paulo - SP, 04794-000, Brazil"
Pé de Caju Bar & Petiscaria,"R. Luiz Fiorotti, 949 - Olímpico, São Caetano do Sul - SP, 09570-030, Brazil"
CaJu Lanches e Salgados,"R. Itapiruna, Nº 299 - Jardim Petroni, São Bernardo do Campo - SP, 09761-040, Brazil"
Boteco do Juca,"R. Ibipetuba, 182 - Alto da Mooca, São Paulo - SP, 03127-180, Brazil"
Caju,"Rua Cristovão de Figueiredo, 108 - Parque Maria Helena, São Paulo - SP, 05855-230, Brazil"
Empório Caju - Cerealista,"R. Álvaro Rodrigues, 26 - Cidade Monções, São Paulo - SP, 04582-000, Brazil"
Restaurante Caju Verde,"Av. Vital Brasil, 861 - Butantã, São Paulo - SP, 05503-001, Brazil"
Restaurante do Caju,"R. Moisés de Corena, 1038 - Cidade Tiradentes, São Paulo - SP, 08475-170, Brazil"
Lanchonete e Restaurante Caju Verde,"Av. Nove de Julho, 3622 - Jardim Paulista, São Paulo - SP, 01406-000, Brazil"
Lanchonete e Restaurante Caju,"05508-090, R. do Matão, 622-878 - Butantã, São Paulo - SP, 05508-090, Brazil"
Tapiocas e pastéis gourmet do cajú,"R. 12 de Agosto, 1 - Montanhão, São Bernardo do Campo - SP, 09783-515, Brazil"
Caju,"R. Manicoré, 788 - Vila Floresta, Santo André - SP, 09050-020, Brazil"
Vila Caju,"Vila Caju, São Paulo - State of São Paulo, Brazil"
Lanchonete Nova Skina Caju Verde,"R. Iperoig, 771 - Perdizes, São Paulo - SP, 05016-000, Brazil"
Lanchonete e Restaurante Toca do Caju,"R. Rangel Pestana, 361 - Centro, São Vicente - SP, 11320-010, Brazil"
Maria Caju,"Av. Siqueira Campos, 342 - Boqueirão, Santos - SP, 11045-201, Brazil"
Caju Bar,"R. Sebastião Afonso, 437 - Jardim Miriam, São Paulo - SP, 04417-100, Brazil"
CAJU MEL DOCES,"R. Tutóia, 1010 - Vila Mariana, São Paulo - SP, 04007-005, Brazil"
Caju açai e lanches,"Av. Pres. Castelo Branco, 3113 - Jardim Zaira, Mauá - SP, 09321-375, Brazil"
Atacadão - São Bernardo Centro,"R. Mal. Deodoro, 2785 - Centro, São Bernardo do Campo - SP, 09710-193, Brazil"
Web Atacados,"R. Príncipe Humberto, N° 112 - Centro, São Bernardo do Campo - SP, 09725-200, Brazil"
Vencedor Atacadista,"R. dos Vianas, 2781 - Baeta Neves, São Bernardo do Campo - SP, 09761-000, Brazil"
Atacado Bem Barato,"Av. Maria Servidei Demarchi, 1911 - Demarchi, São Bernardo do Campo - SP, 09820, Brazil"
Assaí Atacado e Varejo,"Av. Piraporinha, 680 - Planalto, São Bernardo do Campo - SP, 09891-001, Brazil"
Mafat atacado de roupas semi novas e variedades,"R. Argia, 548 - Assunção, São Bernardo do Campo - SP, 09810-620, Brazil"
Tenda Atacado - Diadema,"Av. Fábio Eduardo Ramos Esquivel, 3000 - Canhema, Diadema - SP, 09941-202, Brazil"
D&S Atacado e Varejo Infantil,"Av. Robert Kennedy, 3386 - Assunção, São Bernardo do Campo - SP, 09860-214, Brazil"
Grupo Bem Barato,"Av. Humberto de Alencar Castelo Branco, 3100 - Jardim do Imperador, São Bernardo do Campo - SP, 09851-070, Brazil"
Atacado de folheados,"R. Djalma Dutra, 43 - Centro, São Bernardo do Campo - SP, 09725-435, Brazil"
BRITO & CASONATO Distribuidora de TNT (tecido-nao-tecido),"R. Quirino de Lima, 142 - Centro, São Bernardo do Campo - SP, 09715-370, Brazil"
Atento atacadista,"Av. Pery Ronchetti, 580 - Nova Petrópolis, São Bernardo do Campo - SP, 09771-001, Brazil"
Mega Boi,"Av. Luiz Pequini, 929 - Santa Terezinha, São Bernardo do Campo - SP, 09780-250, Brazil"
L Modas Jeans Atacado e Varejo,"Av. Dom Pedro de Alcântara, 330 - Vila Sao Pedro, São Bernardo do Campo - SP, 09784-000, Brazil"
Utensílios e Utilidades Domésticas Atacado e Varejo Estrela Das Compras,"R. Padre Antônio de Souza Lima, 353 - Assunção, São Bernardo do Campo - SP, 09810-170, Brazil"
Carne Atacado,"R. Barra Mansa, 102 - Vila Bela Vista, Santo André - SP, 09181-200, Brazil"
Formosa Atacado,"R. Nicolau Copérnico, 105 - Vila América, Santo André - SP, 09015-330, Brazil"
Reis Atacado,"R. Fábio da Silva Prado, 185 - Vila Florida, São Bernardo do Campo - SP, 09661-000, Brazil"
Assaí Atacadista,"Av. Pereira Barreto, 2444 - Jardim Bom Pastor, Santo André - SP, 09190-210, Brazil"
J.A modas e Lingeries atacado e varejo,"R. Camile Flamarion, 54 - Alves Dias, São Bernardo do Campo - SP, 09856-480, Brazil"
Grupo Bem Barato,"Av. Brg. Faria Lima, 1775 - Centro, São Bernardo do Campo - SP, 09720-010, Brazil"
"Oba Hortifruti Farm - Mercado, Frutas, Verduras, Legumes, Açougue e Adega","Av. Francisco Prestes Maia, 1491 - Centro, São Bernardo do Campo - SP, 09770-000, Brazil"
Hirota Food,"R. Américo Brasiliense, 532 - Centro, São Bernardo do Campo - SP, 09715-021, Brazil"
Mercado DuParque ll,"Av. Luiz Pequini, 203 - Santa Terezinha, São Bernardo do Campo - SP, 09780-250, Brazil"
DIA Supermercado,"R. Tiradentes, 1399 - Jardim Atlantico, São Bernardo do Campo - SP, 09791-301, Brazil"
Extra Mercado,"Av. Maria Servidei Demarchi, 1897 - Demarchi, São Bernardo do Campo - SP, 09820-000, Brazil"
Extra Mercado,"Praça Bom Jesus de Piraporinha, 425 - Piraporinha, Diadema - SP, 09951-550, Brazil"
MinhaAmazonBR,"R. Brasílio Machado, 308 - Centro, São Bernardo do Campo - SP, 09715-140, Brazil"
May 13,"Av. Albert Schweitzer, 600 - Ferrazópolis, São Bernardo do Campo - SP, 09790-000, Brazil"
Almeida Leme market,"R. Almeida Leme, 191 - Vila Tocantins, São Bernardo do Campo - SP, 09761-170, Brazil"
Mercado Lucas,"R. Dracena, 330 - Jardim Alvorada, Santo André - SP, 09180-390, Brazil"
Vencedor Atacadista,"Av. Dr. José Fornari, 1645 - Ferrazópolis, São Bernardo do Campo - SP, 09790-400, Brazil"
Extra Mercado,"Av. Humberto de Alencar Castelo Branco, 4001 - Assunção, São Bernardo do Campo - SP, 09850-350, Brazil"
Mercado Jupiter 1,"R. Capitão-Mor Antônio de Oliveira, 08 - Vila Goncalves, São Bernardo do Campo - SP, 09725-110, Brazil"
Bom Fran Mercado,"Av. Francisco Prestes Maia, 1223 - Santa Terezinha, São Bernardo do Campo - SP, 09770-000, Brazil"
Mercado Cico,"R. Everaldo Martins de Vasconcelos, 139 - 143 - Santa Terezinha, São Bernardo do Campo - SP, 09781-300, Brazil"
Mercado Loyola,"Av. Aclimação, 682 - Jardim do Estádio, Santo André - SP, 09172-030, Brazil"
Supermercado Sambelar,"R. Lázara de Oliveira Leite - Conj. Hab. Leao de Ouro, São Bernardo do Campo - SP, 09811-375, Brazil"
Mercado Bom Preço,"R. Mathilde Ferrari Marçon - Bairro dos Casa, São Bernardo do Campo - SP, 09840-360, Brazil"
Mercado Azevedo,"Neres Santos - R. Profa. Alice Neres Santos, 75 - Bairro dos Casa, São Bernardo do Campo - SP, 09850-000, Brazil"
EMPÓRIO ALEX - SÃO BERNARDO PLAZA SHOPPING,"Av. Rotary, 624 - Centro, São Bernardo do Campo - SP, 09721-000, Brazil"
Empório Prime,"Av. Dom Jaime de Barros Câmara, 710 - Planalto, São Bernardo do Campo - SP, 09895-400, Brazil"
Empório do Amâncio,"R. João Pessoa, 319 - Centro, São Bernardo do Campo - SP, 09715-000, Brazil"
Empório Marcon - Padaria em São Bernardo,"R. Tiradentes, 1837 - Santa Terezinha, São Bernardo do Campo - SP, 09780-000, Brazil"
Empório Eliete,"R. Olavo Bilac, 427 - Jardim Olavo Bilac, São Bernardo do Campo - SP, 09725-570, Brazil"
Restaurante Empório Demarchi no Centro,"R. Frei Gaspar, 16 - Centro, São Bernardo do Campo - SP, 09721-180, Brazil"
EMPÓRIO BLACK BAETA,"R. Giacinto Tognato, 1273B - Baeta Neves, São Bernardo do Campo - SP, 09760-372, Brazil"
Barbecue is the name,"Av. Kennedy, 715 - Jardim do Mar, São Bernardo do Campo - SP, 09726-262, Brazil"
Empório do Miro,"Av. Dom Pedro de Alcântara, 170 - Montanhão, São Bernardo do Campo - SP, 09784-000, Brazil"
Emporio abadejo,"R. Américo Brasiliense, 33 - Centro, São Bernardo do Campo - SP, 09715-020, Brazil"
EMPORIO DO ACO,"Av. Rotary, 624 - Q105 - Ferrazópolis, São Bernardo do Campo - SP, 09721-000, Brazil"
Empório do Bacalhau,"R. Padre Lustosa, 374 - Centro, São Bernardo do Campo - SP, 09710-120, Brazil"
EMPÓRIO ALEX - SBC - CENTRO,"R. Mal. Deodoro, 650 - Centro, São Bernardo do Campo - SP, 09710-010, Brazil"
Emporio Norte Natural,"R. Mal. Deodoro, 1819 - Centro, São Bernardo do Campo - SP, 04738-001, Brazil"
EMPÓRIO SETE MESTRES,"R. Wadia Jafete Assad, 245 - Dos Casa, São Bernardo do Campo - SP, 09850-090, Brazil"
Empório Esperança,"Montanhão, São Bernardo do Campo - State of São Paulo, 09783-180, Brazil"
Empório Uai Berno melhor de Minas SBC,"R. dos Vianas, 2247 - Baeta Neves, São Bernardo do Campo - SP, 09760-510, Brazil"
Empório Canaã,"Alameda Dom Pedro de Alcântara, 599 - Nova Petrópolis, São Bernardo do Campo - SP, 09771-281, Brazil"
Empório Grand Prime,"Av. Pereira Barreto, 1806 - Paraíso, Santo André - SP, 09751-000, Brazil"
Empório EPB,"Av. Imperador Pedro II, 820 - Nova Petrópolis, São Bernardo do Campo - SP, 09770-420, Brazil"
7cdrinks - Batidas & caipirinhas,"Estr. do Retiro, 325 B - Santa Terezinha, São Paulo - SP, 04474-150, Brazil"
Marula Artesanal Morin - Licor,"Sala de reunião, Edifício Red Tatuapé - R. Serra de Bragança, 1555 - Vila Gomes Cardim, São Paulo - SP, 03318-000, Brazil"
Imigrantes Bebidas,"Av. Professor Luiz Ignácio Anhaia Mello, 7600 - Vila Ema, São Paulo - SP, 03294-000, Brazil"
Magazine,"Av. Rotary, 664 - Centro, São Bernardo do Campo - SP, 09390-121, Brazil"
Empório Frei Caneca,"R. Frei Caneca, 569 - Consolação, São Paulo - SP, 01307-001, Brazil"
Cachaçaria Dalic,"R. Corá Coralina, 8 - Jardim Cruzeiro, Mauá - SP, 09330-801, Brazil"
Cachaça é Presente,"Dentro do Sonda Supermercados Na Galeria Piso 1 em frente a Hering - Av. Pereira Barreto, 1.500 - Centro, São Bernardo do Campo - SP, 09751-000, Brazil"
Emporio Vignamazzi | Center Norte,"Tv. Casalbuono, 120 - loja 10 - Vila Guilherme, São Paulo - SP, 02089-900, Brazil"
Empório Frades,"Av. do Cursino, 129 - Vila da Saúde, São Paulo - SP, 04133-000, Brazil"
Imigrantes Bebidas,"R. Alvarenga, 267 - Butantã, São Paulo - SP, 05509-000, Brazil"
Licoretto Bebidas,"Av. Washington Luís, 3341 - Chácara Flora, São Paulo - SP, 04627-000, Brazil"
Adega Do Alê,"Rua Oscar Schade, 126 - Vila Inglesa, São Paulo - SP, 04653-130, Brazil"
Liquore di Famiglia - Licores artesanais,"R. do Arraial - Vila Mariana, São Paulo - SP, 04122-030, Brazil"
Drinks distributor Hs,"Av. Carlos Gomes, 773 - Vila Boa Vista, Santo André - SP, 09061-510, Brazil"
Imigrantes Bebidas,"R. Cap. Alberto Mendes Júnior, 660 - Água Fria, São Paulo - SP, 02335-011, Brazil"
Atento atacadista,"Av. Pery Ronchetti, 580 - Nova Petrópolis, São Bernardo do Campo - SP, 09771-001, Brazil"
Mister Bebidas,"R. Domenico Aníbal, 271 - Americanópolis, São Paulo - SP, 04427-030, Brazil"
"Empório Marino , Produtos Importados no ABC","Av. Winston Churchill, N° 919 - Rudge Ramos, São Bernardo do Campo - SP, 09614-000, Brazil"
Adega La Casa das Bebidas,"Av. Inconfidência Mineira, 1959 - Vila Antonieta, São Paulo - SP, 03476-010, Brazil"
Vilari Empório de Bebidas,"Av. Salgado Filho, nº1173 - Centro, Guarulhos - SP, 07115-000, Brazil"
Instituto Baru,"R. Boturoca, 206 - Vila Indiana, São Paulo - SP, 05586-010, Brazil"
Baru,"Rua Professor Cesare Lombroso, 259 -59 - Bom Retiro, São Paulo - SP, 01122-021, Brazil"
Barú Marisquería,"R. Augusta, 2542 - Cerqueira César, São Paulo - SP, 01412-100, Brazil"
Baru Restobar,"R. México, 271 - Pitangueiras, Guarujá - SP, 11410-350, Brazil"
Baru Restaurante,"R. Paulo Lôbo, 57 - Cambuí, Campinas - SP, 13025-210, Brazil"
Baruk Burger Ferrazópoilis SBC,"R. Yasmin, 132 - Ferrazópolis, São Bernardo do Campo - SP, 09782-450, Brazil"
Baru Imóveis,"Av. Angélica, 688 - Higienópolis, São Paulo - SP, 01227-000, Brazil"
Lojabaru,"R. Aimorés, 20 - Bom Retiro, São Paulo - SP, 01122-011, Brazil"
BARU Records,"Av. Francisco Tranchesi, 988 - APT 4 - Itaquera, São Paulo - SP, 08270-460, Brazil"
Baru Learn & Play,"Av. Padre Anchieta, 610 - Jardim, Santo André - SP, 09090-710, Brazil"
Baru Reforma E Construção,"Av. Cel. José Pires de Andrade, 767 - Vila Vera, São Paulo - SP, 04295-001, Brazil"
Baru Surf Br,"R. Jambolão - Parque Viana, Barueri - SP, 06449-090, Brazil"
Baru Trans Transporte Executivo,"R. Rio Grande do Sul, 427 - Vila Boa Vista, Barueri - SP, 06411-060, Brazil"
Baru Utilidades e Conveniencias loja virtual,"R. Onze de Abril, 02 - Vila Zamataro, Guarulhos - SP, 07032-150, Brazil"
SUCO BAGACO SÃO BERNARDO PLAZA,"Av. Rotary, 624 - 3030 - Ferrazópolis, São Bernardo do Campo - SP, 09721-000, Brazil"
Suco Bagaco,"Praça Samuel Sabatini, 200 - Loja L232 - Centro, São Bernardo do Campo - SP, 09750-902, Brazil"
Suco Bagaço Shopping ABC,"PB Praça de alimentação - Av. Pereira Barreto, n° 42 - Quiosque 12 - Vila Gilda, Santo André - SP, 09190-210, Brazil"
Suco Bagaço,"R. Manoel da Nóbrega, 712 - Centro, Diadema - SP, 09910-720, Brazil"
Juice station,"R. Silva Bueno, 2533 - loja 16 - Ipiranga, São Paulo - SP, 04208-053, Brazil"
Guib's - sucos e pasteis e lanches,"Rua Humberto, Av. Humberto de Alencar Castelo Branco - Assunção, São Bernardo do Campo - SP, 09850-360, Brazil"
Mister Coco Sucos Naturais,"R. Francisco Tapajós, 109 - Vila Santo Estefano, São Paulo - SP, 04153-000, Brazil"
Santo Suco,"Av. Brigadeiro Luís Antônio, 1892 - Bela Vista, São Paulo - SP, 01318-002, Brazil"
Madureira Sucos Itaim Bibi,"R. João Cachoeira, 217 - Vila Nova Conceição, São Paulo - SP, 04535-010, Brazil"
Buona Vita,"R. Dom Duarte Leopoldo e Silva, 91 - Centro, Santo André - SP, 09015-560, Brazil"
GoJuice Natural Food,"Av. Kennedy, 700 - Jardim do Mar, São Bernardo do Campo - SP, 09726-260, Brazil"
To 10 Sucos & Lanches,"R. Gen. Glicério, 569 - Centro, Santo André - SP, 09015-191, Brazil"
Pães Doces Sucos Lanches,"Paulicéia, São Bernardo do Campo - State of São Paulo, 09683-000, Brazil"
Vilajo Sucos e Lanches,"R. Bernardino de Campos, 12 - Centro, Santo André - SP, 09015-010, Brazil"
Canapum Sucos,"Av. Quinze de Novembro, 23 - Centro, Santo André - SP, 09015-000, Brazil"
Bom Suco Liberdade,"R. Galvão Bueno, 187 - Liberdade, São Paulo - SP, 01506-000, Brazil"
Restaurante e Lanchonete Nova Geração,"Av. João Firmino, 393 - Assunção, São Bernardo do Campo - SP, 09810-260, Brazil"
Chuá Sucos e Lanches,"R. Estevão Barbosa, 25 - Pompeia, São Paulo - SP, 05030-100, Brazil"
Casa de Sucos K & K,"Av. Conde Francisco Matarazzo, 325 - Fundação, São Caetano do Sul - SP, 09520-120, Brazil"
Marcão Lanches e Sucos,"Av. São Paulo, 585 - Chácara Sergipe, São Bernardo do Campo - SP, 09892-330, Brazil"
Empório Figueira Produtos Naturais,"R. Javaés, 621 - Vila Eldizia, Santo André - SP, 09181-570, Brazil"
Mini Extra,"R. Brasílio Machado - Centro, São Bernardo do Campo - SP, 09715-140, Brazil"
Mil Folhas,"R. Mal. Deodoro, 1620 - Centro, São Bernardo do Campo - SP, 09710-200, Brazil"
hortifrut na villa,"Av. São Bernardo do Campo, 405 - Vila Luzita, Santo André - SP, 09171-100, Brazil"
Brasil Queijos Minas,"R. Wenceslau Richter - Jardim Palermo, São Bernardo do Campo - SP, 09781-220, Brazil"
Rck Produtos,"Av. Robert Kennedy, 3571 - Assunção, São Bernardo do Campo - SP, 09860-215, Brazil"
Mil Folhas Vita,"R. Mal. Deodoro, 692 - Centro, São Bernardo do Campo - SP, 09710-000, Brazil"
Casa do Norte Baião de Dois,"R. Joséfina Leonora Loto Bueno, 529 - Montanhão, São Bernardo do Campo - SP, 09791-510, Brazil"
Viva Bem Orgânicos,"R. Piauí, 700 - Santa Paula, São Caetano do Sul - SP, 09541-150, Brazil"
Loja Korin Moema,"Alameda dos Jurupis, 1503 - Moema, São Paulo - SP, 04088-004, Brazil"
"Pró Saúde - Produtos Naturais, Orgânicos e Alimentos Funcionais","R. Tamoios - Vila Leopoldina, Santo André - SP, 09015-440, Brazil"
Vem da Horta - São Paulo | Orgânicos frescos direto da fonte,"Rua das Flechas, 739 - Vila Santa Catarina, São Paulo - SP, 04364-030, Brazil"
Armazém do Campo,"Alameda Nothmann, 806 - Campos Elíseos, São Paulo - SP, 01216-001, Brazil"
Viva Melhor Empório,"R. Áurea, 155 - Vila Mariana, São Paulo - SP, 04015-070, Brazil"
Empório Grão Verde SBC,"Av. João Firmino, 1637 - Assunção, São Bernardo do Campo - SP, 09812-460, Brazil"
Orgânicos no Ponto,"Av. Corifeu de Azevedo Marques, 250 - Butantã, São Paulo - SP, 05582-000, Brazil"
Point Açaí Natural,"Rua Cassiano Gabus Mendes, 160 Jardim Calux - Planalto, São Bernardo do Campo - SP, 09896-160, Brazil"
Maria do Grão Orgânicos e Integrais,"R. Dr. Gentil Leite Martins, 104 - Vila Nova Caledonia, São Paulo - SP, 04648-000, Brazil"
Econiwa Loja de Produtos Orgânicos Vila Mariana,"R. Rio Grande, 785 - Vila Mariana, São Paulo - SP, 04018-002, Brazil"
2 Marias Saudável Orgânico - Tatuapé,"R. Azevedo Soares, 1615 - Tatuapé, São Paulo - SP, 03322-001, Brazil"
State of Pará,"State of Pará, Brazil"
Liobras Produtos Liofilizados Brasileiros,"R. Ferreira Viana, 902 - Vila Socorro, São Paulo - SP, 04761-010, Brazil"
"""Fábrica Doces Cristalizado Caseiros Minas Gerais Atacado Direto Fábrica em toda Cidade Brasil""","Escritório Vendas Online Da Empresa Empresa Trabalha Somente Vendas Via Internet - R. Ademar Douat, 836A - Jardim Aeroporto II, Alfenas - MG, 37130-000, Brazil"
Fábrica de Doces Confirma,"R. Henrique Felipe da Costa, 746 - Vila Guilherme, São Paulo - SP, 02054-040, Brazil"
BISA Doces cristalizados,"R. Riachuelo, 755 - Centro, Mococa - SP, 13730-070, Brazil"
Loja Doces de Minas,"R. Pio XII, 164 - Rudge Ramos, São Bernardo do Campo - SP, 09624-020, Brazil"
Doces Cristalizados D. Conceição,"Av. Perimetral, 2489 - St. Bueno, Goiânia - GO, 74215-005, Brazil"
Doces & Cia,"Av. Caminho do Pilar - Vila Gilda, Santo André - SP, 09190-000, Brazil"
Magic Doces,"Av. Souza Ramos, 103 - Cidade Tiradentes, São Paulo - SP, 08490-490, Brazil"
Dona Zilda Doces Cristalizados,"R. João Carlos Cortelari - Fragata, Pelotas - RS, 96045-110, Brazil"
Realc Doces Artesanais,"R. Osório Franco Vilhena, 90 - Vila Nova Curuca, São Paulo - SP, 08030-590, Brazil"
Distribuidora De Doce De Minas Caseiro,"R. Padre Mariano Ronchi, 1294 - Vila Pereira Cerca, São Paulo - SP, 02932-000, Brazil"
Encantado Doces,"R. Manoel Fernandes Dias, 55 - Jardim Novo Campos Eliseos, Campinas - SP, 13060-110, Brazil"
Dona Diva Sweets,"Rua da Cantareira, 306. - Mercado Municipal Paulistano, Rua L, box 30. - Centro Histórico de São Paulo, São Paulo - SP, 02290-000, Brazil"
Cantinho Energético - Guaraná do Amazonas,"R. Daniel Nunes de Castro, 136 - Piraporinha, Diadema - SP, 09951-470, Brazil"
GUARANA,"Av. Pereira Barreto, 42 - Vila Gilda, Santo André - SP, 09190-210, Brazil"
Supermercados Joanin,"R. Tiradentes, 1701 - Santa Terezinha, São Bernardo do Campo - SP, 09780-265, Brazil"
O Xapero Hamburgueria,"Rua: João Pedro Roqueti, 30 - Loja 80 - Centro, São Bernardo do Campo - SP, 09720-200, Brazil"
Hirota Food,"R. Américo Brasiliense, 532 - Centro, São Bernardo do Campo - SP, 09715-021, Brazil"
"Oba Hortifruti Farm - Mercado, Frutas, Verduras, Legumes, Açougue e Adega","Av. Francisco Prestes Maia, 1491 - Centro, São Bernardo do Campo - SP, 09770-000, Brazil"
Carrefour Bairro São Bernardo,"Rua José Benedetti, 247 - São Bernardo do Campo, SP, 09770-140, Brazil"
Grupo Bem Barato,"Av. Brg. Faria Lima, 1775 - Centro, São Bernardo do Campo - SP, 09720-010, Brazil"
Pastel com guaraná Ltda me,"R. Renê de Oliveira Greco, 132 - Parque Sao Vicente, Mauá - SP, 09371-452, Brazil"
