Império das Castanhas,"R. Cel. Cahet, 9 - Levada, Maceió - AL, 57017-090, Brazil",
Bodega da Castanha,"Av. Silvio Carlos Viana, 1447 - Ponta Verde, Maceió - AL, 57035-160, Brazil",
Sabor Maceió,"Feirinha de Artesanato da Pajuçara - Av. Dr. Antônio Gouveia, 1350 - Box 89 - Pajuçara, Maceió - AL, 57030-500, Brazil",
Cajual Produtos Nordestinos,"AL-101, 1350 - Pajuçara, Maceió - AL, 57030-500, Brazil",
VIVA + CAJÚ - CASTANHAS,"GALERIA ARTCENTER PAJUÇARA - Av. Dr. Antônio Gouveia, 1113 - Pajuçara, Maceió - AL, 57030-170, Brazil",
Casa Nordeste Pajuçara,"R. Dr. Lessa de Azevedo, 59 - Loja 6 - Pajuçara, Maceió - AL, 57030-180, Brazil",
O Baiano,"Tv. São José, 7 - número 7 - Jacintinho, Maceió - AL, 57040-485, Brazil",
Limaalimentos fábiano das castanhas,"Em Frente ao Bradesco - R. Sá e Albuquerque - Jaraguá, Maceió - AL, 57043-330, Brazil",
LIAO CASTANHAS,"Al101 - Barra Nova, Mal. Deodoro - AL, 57160-000, Brazil",
Armazém Anandda,"R. Dep. José Lages, 372 C - Ponta Verde, Maceió - AL, 57035-330, Brazil",
Mercado Verde Alimentos Saudáveis,"R. do Comércio, 148 - Centro, Maceió - AL, 57020-000, Brazil",
Gelato Borelli Maceió,"R. Desportista Humberto Guimarães, 541b - Ponta Verde, Maceió - AL, 57035-030, Brazil",
Sam's Club Maceió,"Av. Comendador Gustavo Paiva, 2650 B - Mangabeiras, Maceió - AL, 57037-532, Brazil",
Mundo Verde,"Av. Comendador Gustavo Paiva, 5945 - Cruz das Almas, Maceió - AL, 57038-000, Brazil",
LEVE DIET GOURMET,"R. Empresário Aloísio Bezerra, N° 36 - qd n - Feitosa, Maceió - AL, 57042-290, Brazil",
Jb Passa,"R. José Jorge de Melo Gonçalves, 309 - Jacintinho, Maceió - AL, 57041-115, Brazil",
Cajual Produtos Nordestinos,"AL-101, 1350 - Pajuçara, Maceió - AL, 57030-500, Brazil",
Caju.ateliê,"Conj. Climerio Sarmento - Jatiúca, Maceió - AL, 57036-810, Brazil",
Sabor Maceió,"Feirinha de Artesanato da Pajuçara - Av. Dr. Antônio Gouveia, 1350 - Box 89 - Pajuçara, Maceió - AL, 57030-500, Brazil",
VIVA + CAJÚ - CASTANHAS,"GALERIA ARTCENTER PAJUÇARA - Av. Dr. Antônio Gouveia, 1113 - Pajuçara, Maceió - AL, 57030-170, Brazil",
Praça Sandoval Cajú,"Jacintinho, Maceió - State of Alagoas, 57041-450, Brazil",
Recanto do Cajueiro,"AL-101, 333 - Garça Torta, Maceió - AL, 57039-020, Brazil",
Carne de Caju Delícias,"R. Prof. Graça Leite, 21 - Gruta de Lourdes, Maceió - AL, 57052-520, Brazil",
Caju Ameixa,"R. Olavo Macêdo Ribeiro, 172 - Jatiúca, Maceió - AL, 57036-830, Brazil",
Chocolate Brasil Cacau,"Rua do Livramento, 92 - Centro, Maceió - AL, 57020-030, Brazil",
Ponto do Açaí,"Av. Dr. Antônio Gomes de Barros, 125 - Jatiúca, Maceió - AL, 57036-360, Brazil",
Casa Nordeste,"Rodovia Guther frans de albuquerque sn - Ipioca, Maceió - AL, 57039-720, Brazil",
Cookie Cakau,"Av Pretestato Ferreira Machado, 1526 - Sala F - Jatiúca, Maceió - AL, 57036-400, Brazil",
Cacau Show,"Av. Fernandes Lima, 2551 - Loja 135/1 - Pinheiro, Maceió - AL, 57057-450, Brazil",
Império das Castanhas,"R. Cel. Cahet, 9 - Levada, Maceió - AL, 57017-090, Brazil",
Casa Nordeste Pajuçara,"R. Dr. Lessa de Azevedo, 59 - Loja 6 - Pajuçara, Maceió - AL, 57030-180, Brazil",
Cacau Show Sam's Club,"Av. Comendador Gustavo Paiva, 2650 - Mangabeiras, Maceió - AL, 57037-901, Brazil",
Cacau Especial,"R. Dr. Augusto Cardoso, 11 - Jatiúca, Maceió - AL, 57035-590, Brazil",
Bodega da Castanha,"Av. Silvio Carlos Viana, 1447 - Ponta Verde, Maceió - AL, 57035-160, Brazil",
Cacau Show - Chocolates,"Shopping - Av. Comendador Gustavo Paiva, 2990 - Mangabeiras, Maceió - AL, 57032-901, Brazil",
Cacau Show,"Av. Fernandes Lima, 3700 - Loja 12 - Gruta de Lourdes, Maceió - AL, 57052-400, Brazil",
Atacadão - Maceió Aeroporto,"Av. Durval de Góes Monteiro, 4466 - Tabuleiro do Martins, Maceió - AL, 57061-000, Brazil",
Super Atacado - Antares,"Av. Menino Marcelo, 3038 - Antares, Maceió - AL, 57083-410, Brazil",
Atacadão Boa Vista,"R. do Comércio, 429 - Centro, Maceió - AL, 57020-000, Brazil",
Big Atacado,"R. Cirílo de Castro, 259 - Levada, Maceió - AL, 57017-050, Brazil",
Atacadão - Maceió,"Av. Josepha Hollanda de Mello, S/N - Jacarecica, Maceió - AL, 57038-500, Brazil",
Atacadão - Maceió Petrópolis,"Av. Durval de Góes Monteiro, 6775 - Petropolis, Maceió - AL, 57061-000, Brazil",
Assaí,"Av. Menino Marcelo, s/n - Serraria, Maceió - AL, 57046-000, Brazil",
Dmais Atacado e Varejo,"Pista Nova Da Santa Lúcia - Av. Francisco Afonso de Melo, 1878 - QD 53 Lote 10 - Santa Lúcia, Maceió - AL, 57082-874, Brazil",
Assaí Atacadista,"Av. Durval de Góes Monteiro, 10.580 - Tabuleiro do Martins, Maceió - AL, 57081-285, Brazil",
PH Atacado,"R. da Alegria, 259 - Centro, Maceió - AL, 57020-010, Brazil",
Assaí Atacadista,"Av. Fernandes Lima, 4.000 - Gruta de Lourdes, Maceió - AL, 57052-403, Brazil",
ATACADÃO FEITOSA,"Av. Gov. Lamenha Filho, 1469 - Feitosa, Maceió - AL, 57043-000, Brazil",
Assaí Atacadista,"Av. Comendador Gustavo Paiva, 3.261 - Mangabeiras, Maceió - AL, 57037-532, Brazil",
Alforria Atacado,"Av. Tancredo Neves, 373-417 - Cidade Universitária, Maceió - AL, 57073-370, Brazil",
Atacado Maceió,"Praça da Maravilha, 5 - Poço, Maceió - AL, 57025-860, Brazil",
Atacadão dos Kits Maceió,"Av. Siqueira Campos, 1923 - Trapiche, Maceió - AL, 57010-405, Brazil",
Felicidade Distribuidor Atacadista,"Av. Durval de Góes Monteiro, 2263 - Tabuleiro do Martins, Maceió - AL, 57060-150, Brazil",
NL ATACADOS,"Av. Ver. Dário Marsíglia, 470 - Tabuleiro do Martins, Maceió - AL, 57081-015, Brazil",
Atacadão do Jeans ADJ - Loja 3,"R. Dois de Dezembro, 103 - Centro, Maceió - AL, 57020-120, Brazil",
Atacadão Boa Vista,"R. Boa Vista, 243 - Centro, Maceió - AL, 57020-110, Brazil",
Mercado Popular,"R. Barão de Alagoas - Levada, Maceió - AL, 57017-160, Brazil",
Mercado da Produção,"Av. Francisco de Menezes - Levada, Maceió - AL, 57020-210, Brazil",
MERCADO PÚBLICO,"Av. Maceió - Tabuleiro do Martins, Maceió - AL, 57061-110, Brazil",
Peixaria Peixe Dourado,"Mercado da Produção - Levada, Maceió - AL, 57020-210, Brazil",
Mercado Público do Jacintinho,"R. Primeiro de Marco, 238-346 - Jacintinho, Maceió - AL, 57040-225, Brazil",
Mercado do Artesanato,"Parque Rio Branco, 71 - Levada, Maceió - AL, 57017-150, Brazil",
Palato,"R. Dep. José Lages, 700 - Ponta Verde, Maceió - AL, 57035-688, Brazil",
UniCompra,"R. Durval Guimarães, S/N - Ponta Verde, Maceió - AL, 57035-060, Brazil",
UniCompra,"R. José Soares Sobrinho, 69 - Box 3 - Jatiúca, Maceió - AL, 57036-640, Brazil",
Emporio nordestino,"Mercado da Produção - Levada, Maceió - AL, 57020-210, Brazil",
Mercado das Artes 31,"Av. Indl. Cícero Toledo, 31 - Jaraguá, Maceió - AL, 57022-170, Brazil",
Mercado da Feirinha do Jacintinho,"R. São José - Jacintinho, Maceió - AL, 57040-510, Brazil",
Mini Market Pajuçara,"R. Elísio de Carvalho, 319 - Pajuçara, Maceió - AL, 57030-087, Brazil",
Mercado da Gruta,"R. Ranildo Cavalcante - Gruta de Lourdes, Maceió - AL, 57052-827, Brazil",
UniCompra,"Av. Tomás Espíndola, 472 - Farol, Maceió - AL, 57051-000, Brazil",
District Flower,"R. Alm. Tamandaré, 144 - Prado, Maceió - AL, 57010-030, Brazil",
Mercadinho Alagoiás,"R. João Camerino, 145 - Loja 05 - Pajuçara, Maceió - AL, 57030-090, Brazil",
Supermercado Mega Marx Feitosa,"R. Edson Moura Teixeira - Feitosa, Maceió - AL, 57042-225, Brazil",
G supermercado,"Av. Eng. Paulo Brandão Nogueira - Jatiúca, Maceió - AL, 57036-550, Brazil",
José Francisco dos Santos Mercado,"R. Dois, 10 - Jacintinho, Maceió - AL, 57040-360, Brazil",
Empório Maceió,"R. Des. Herman Soares Tôrres, 209-A - Casa - Gruta de Lourdes, Maceió - AL, 57052-402, Brazil",
Empório Farol,"Av. Aristeu de Andrade, 309 - Farol, Maceió - AL, 57051-090, Brazil",
Emporio nordestino,"Mercado da Produção - Levada, Maceió - AL, 57020-210, Brazil",
Empório Colina Maceió,"R. Est. Arnoumar Chagas, 206-212 - Santa Amélia, Maceió - AL, 57063-430, Brazil",
Empório Top | Loja de Roupas e Acessórios Masculinos em Maceió,"R. Eng. Mario de Gusmão, 1098 - Ponta Verde, Maceió - AL, 57035-000, Brazil",
"Empório Millano - Vinhos, Massas, Risotos, Tábuas de Frios","Av. João Davino, 96 - Jatiúca, Maceió - AL, 57035-554, Brazil",
Empório Panificação,"Av. Gov. Lamenha Filho, 2324 - Feitosa, Maceió - AL, 57043-600, Brazil",
Empório La Zuka,"R. Dr. Augusto Cardoso, 11 - Loja 01 - Jatiúca, Maceió - AL, 57035-590, Brazil",
EMPORIO R > MODA FEMININA,"Av. Dr. Antônio Gomes de Barros, 124-C - Jatiúca, Maceió - AL, 57036-170, Brazil",
Empório Ariel,"Cidade Universitária, Maceió - State of Alagoas, Brazil",
Estilo Empório,"Av. Industrial Cícero Toledo, 31 Mercado 31 Loja 52, 58 - Jaraguá, Maceió - AL, 57022-170, Brazil",
Empório Do Sertão Frios & Laticínios,"R. Fiscal Vera de Mello Queiroz - Cruz das Almas, Maceió - AL, 57038-008, Brazil",
Emporium bread,"R. Profa. Olindina Pereira da Silva, 549 A - Antares, Maceió - AL, 57083-000, Brazil",
Empório Pizzaria,"Av. Pratagy - Benedito Bentes, Maceió - AL, 57084-080, Brazil",
Empório Nordeste Carnes,"Murilópolis, Av. Eraldo Lins Cavalcante, 2045 - Serraria, Maceió - AL, 57046-570, Brazil",
Império Store Maceió,"R. Cleto Campelo, 44 - Jacintinho, Maceió - AL, 57041-610, Brazil",
Emporio do Aço,"Av. Menino Marcelo, 3800 - Cidade Universitária, Maceió - AL, 57073-900, Brazil",
Empório da Pizza,"R. Marquês de Tamandaré, 244 - Santa Lúcia, Maceió - AL, 57082-090, Brazil",
Anis Estrela - licores artesanais,"R. Prof. José da Silveira Camerino, 290 - Pinheiro, Maceió - AL, 57055-630, Brazil",
Baru Clothes,"Av. Dr. Antônio Gomes de Barros, 900A - Jatiúca, Maceió - AL, 57036-000, Brazil",
Acarajé do baru,"Av. Garça Torta, 439 - Benedito Bentes, Maceió - AL, 57084-615, Brazil",
Ponto do Suco,"Av. Comendador Leão, 197 - Jaraguá, Maceió - AL, 57022-240, Brazil",
Suco Bagaço,"Av. Dona Constança de Góes Monteiro, 1543-1609 - Jatiúca, Maceió - AL, 57036-371, Brazil",
Sucolândia,"R. B, 490-594 - Tabuleiro do Martins, Maceió - AL, 57081-006, Brazil",
Sabor Tropical - Açaí e Sucos Energéticos,"Av. Moreira Lima, 474 - Centro, Maceió - AL, 57020-220, Brazil",
Nature sucos & sanduiches,"R. Dep. Elizeu Teixeira, S/N - Jatiúca, Maceió - AL, 57035-747, Brazil",
TropiKana,"galeria Pontes - Av. Menino Marcelo, 9353 - Serraria, Maceió - AL, 57046-005, Brazil",
Indústria de suco pronts LTDA,"Av. Francisco de Menezes, 283 - loja 02 - Levada, Maceió - AL, 57017-075, Brazil",
Rice's Sucos e Lanches,"Rua Hamilton de Barros Soutinho, 80-160 - Jatiúca, Maceió - AL, 57035-690, Brazil",
Mister Suco Saladeria,"R. Pedro Loureiro Farias - Feitosa, Maceió - AL, 57042-450, Brazil",
Êbah Sucos,"R. Padre Cícero, 923 - Antares, Maceió - AL, 57048-714, Brazil",
NatuSuco/LanchesMcz,"Av. Silvio Carlos Viana - Ponta Verde, Maceió - AL, 57035-160, Brazil",
Polpa de Fruta- Sucolândia Serraria,"Av. Menino Marcelo, 9125 A - Serraria, Maceió - AL, 57046-000, Brazil",
Açaí Topadão,"Avenida Governador Afrânio Lages, Centro, Maceió - AL, 57020-088 Cambona, Maceió - AL, 57020-088, Brazil",
Ponto do Açaí,"Av. Dr. Antônio Gomes de Barros, 125 - Jatiúca, Maceió - AL, 57036-360, Brazil",
Guaraná da Praia,"Em frente ao, Condomínio Edifício Belize - Av. Álvaro Otacílio, s/n - Ponta Verde, Maceió - AL, 57035-180, Brazil",
Açaibis,"R. Quintino Bocaiúva, 581 - Ponta da Terra, Maceió - AL, 57030-005, Brazil",
Encontro do suco,"Conj. Virgem dos pobres ||| Q 17 N°1 - Trapiche da Barra, Maceió - AL, 57010-795, Brazil",
Açaí Concept,"R. Durval Guimarães, S/N - Ponta Verde, Maceió - AL, 57035-060, Brazil",
Açaí Concept,"R. Dr. Pedro Monteiro, 225 - Centro, Maceió - AL, 57020-380, Brazil",
Açaí Concept,"Av. Comendador Gustavo Paiva, 2650 - Jatiúca, Maceió - AL, 57031-530, Brazil",
Santa Feira Maceió - SantOrégano Pizzas e Massas,"Rodovia - AL 101 Norte, 56 - Riacho Doce, Maceió - AL, 57039-230, Brazil",
Feira Verde Maceió,"Av. Comendador Gustavo Paiva, 5945 - Cruz das Almas, Maceió - AL, 57038-000, Brazil",
Feira Agroecológica Santo Eduardo,"R. Dep. João Malta Taváres, 2 - Poço, Maceió - AL, 57025-085, Brazil",
Raiz Mais Organics - Loja de Produtos Naturais,"Av. Pres. Getúlio Vargas, 390 - Serraria, Maceió - AL, 57046-140, Brazil",
Organic,"Av. Siqueira Campos - Prado, Maceió - AL, 57010-265, Brazil",
Viva Nature,"R. da Alegria, 333 - Centro, Maceió - AL, 57020-320, Brazil",
Ícaro Hortfrutas,"Av. José Camelo de Freitas, 2023 - Village Campestre, Maceió - AL, 57073-218, Brazil",
Açafrão da Terra,"Av. Dr. Antônio Gomes de Barros, 732 - Jatiúca, Maceió - AL, 57036-001, Brazil",
Feirinha de Orgânicos,"Praça do Centenario - Farol, Maceió - AL, 57051-000, Brazil",
Camomila Produtos Naturais,"Av. João Davino, 340 - Jatiúca, Maceió - AL, 57035-554, Brazil",
Côco Mania & Hortifruti,"Avenida rosivaldo mendes - Cidade Universitária, Maceió - AL, 57073-162, Brazil",
Apiário Ouro Verde,"R. Godofredo Ferro, 99 - Centro, Maceió - AL, 57020-570, Brazil",
Armazém Anandda,"R. Dep. José Lages, 372 C - Ponta Verde, Maceió - AL, 57035-330, Brazil",
Império das Castanhas,"R. Cel. Cahet, 9 - Levada, Maceió - AL, 57017-090, Brazil",
Shake da Sol,"Conveniência do posto BR - Av. Tomás Espíndola, 156 - Farol, Maceió - AL, 57051-000, Brazil",
Mercado do Grão,"R. Cleto Campelo, 27 - Jacintinho, Maceió - AL, 57041-000, Brazil",
ALECRIM PRODUTOS NATURAIS,"R. Luiz clemente Vasconcelos, 15 - Clima Bom, Maceió - AL, 57071-040, Brazil",
Jaraguá Hortifruti Mercato,"Mercado Público do Jaraguá - Av. Comendador Leão - Jaraguá, Maceió - AL, 57022-240, Brazil",
Mercado Verde Alimentos Saudáveis,"R. do Comércio, 148 - Centro, Maceió - AL, 57020-000, Brazil",
Mundo Verde Maceió,"R. Eng. Mario de Gusmão, 440 - Ponta Verde, Maceió - AL, 57035-000, Brazil",
Sabor Maceió,"Feirinha de Artesanato da Pajuçara - Av. Dr. Antônio Gouveia, 1350 - Box 89 - Pajuçara, Maceió - AL, 57030-500, Brazil",
Galeria Cristal,"Tv. Antônio Maciel de Oliveira, 850 - Ponta Verde, Maceió - AL, 57035-280, Brazil",
Marinho Polimento Cristalizado,"Rua - R. Paraná, 73 - Poço, Maceió - AL, 57025-120, Brazil",
Cristal Car,"R. Nossa Sra. Aparecida, 08 - Santa Lúcia, Maceió - AL, 57082-560, Brazil",
ESTETICAR CUIDADOS AUTOMOTIVOS,"Av. Sebastião Corrêia da Rocha - Tabuleiro do Martins, Maceió - AL, 57061-410, Brazil",
Cristal pet,"R. Doná Maria de Lourdes Brandão, 2-104 - Tabuleiro do Martins, Maceió - AL, 57061-210, Brazil",
Cristal Modas,"R. do Comércio, 684 - Centro, Maceió - AL, 57020-000, Brazil",
Polimento Cristalizado,"Jacintinho, Maceió - State of Alagoas, 57041-440, Brazil",
Banho de Cristal,"R. Cleto Campelo, 100 - Jacintinho, Maceió - AL, 57041-000, Brazil",
J.J Lava Jato E Polimento Cristalizado,"R. Antônio de Andrade, 80 - Tabuleiro do Martins, Maceió - AL, 57081-574, Brazil",
Edifício Cristal,"Tv. Serafim Costa, 216 - Gruta de Lourdes, Maceió - AL, 57052-496, Brazil",
PS Prime - Estética automotiva e Seminovos Premium,"R. Dep. José Lages, 832 - Ponta Verde, Maceió - AL, 57035-330, Brazil",
Suspirito MCZ,"R. E, 232 - Jacintinho, Maceió - AL, 57041-171, Brazil",
Vidral Vidros,"Av. Menino Marcelo, 9100 - Serraria, Maceió - AL, 57046-000, Brazil",
Caf- Crystal Aguas do Nordeste Ltda,"R. Joao Jose Pereira Filho, 1202 - Tabuleiro do Martins, Maceió - AL, 57081-000, Brazil",
Nuponto Estética Automotiva,"Av. Dona Constança de Góes Monteiro, 318 - Jatiúca, Maceió - AL, 57036-370, Brazil",
SVS ACESSÓRIOS - Loja de bijuterias em Maceió AL,"Deputado José Lages, 850 - Galeria Cristal, Loja 03 - Ponta Verde, Maceió - AL, 57036-360, Brazil",
Cristal Modas,"Av. Benedito Bentes, 670 - Benedito Bentes, Maceió - AL, 57084-050, Brazil",
Salão De Festas Ua De Cristal,"R. O - São Jorge, Maceió - AL, 57044-118, Brazil",
Ferreira Detail Estética Automotiva,"em frente a Prosegur - R. Cabo Reis, 103 - Trapiche da Barra, Maceió - AL, 57014-410, Brazil",
Guaraná da Praia Farol,"Av. Fernandes Lima, 869 - Gruta de Lourdes, Maceió - AL, 57050-000, Brazil",
Guaraná da Praia,"Em frente ao, Condomínio Edifício Belize - Av. Álvaro Otacílio, s/n - Ponta Verde, Maceió - AL, 57035-180, Brazil",
Guaraná Energia,"Galeria Produbam - Loja 16, R. Cleto Campelo, 70 - Jacintinho, Maceió - AL, 57041-000, Brazil",
Guaraná do Índio,"Rua Dr. Pompeu Sarmento - Ponta Verde, Maceió - AL, 57035-340, Brazil",
Casa do Guaraná - Polpas de Fruta e Produtos Naturais,"R. Pastor Taváres, 245 - Tabuleiro do Martins, Maceió - AL, 57081-007, Brazil",
Ponto do Açaí,"Av. Dr. Antônio Gomes de Barros, 125 - Jatiúca, Maceió - AL, 57036-360, Brazil",
Guaraná da Praia,"R. José Cabral Acioli, 51 - Jatiúca, Maceió - AL, 57035-680, Brazil",
Guaraná do índio,"R. Santa Cruz, 44 - Farol, Maceió - AL, 57051-590, Brazil",
Guaraná Genial,"R. Desportista Humberto Guimarães, 285 - Ponta Verde, Maceió - AL, 57035-000, Brazil",
