Nutty Bavarian - São Gonçalo Shopping,"Av. São Gonçalo, 100 - Quiosque 20, Piso L2 - Boa Vista, São Gonçalo - RJ, 24466-315, Brazil",
Casas Pedro,"R. Dr. Nilo Peçanha, 22 - Centro, São Gonçalo - RJ, 24445-360, Brazil",
MARA CASTANHA,"Av. Rui Barbosa, 172 - São Francisco, Niterói - RJ, 24360-440, Brazil",
Empório C&B,"R. Moreira Façanha, 328-372 - Rocha, São Gonçalo - RJ, 24421-300, Brazil",
Casas Pedro,"R. Dr. Alfredo Backer, 649 - Alcantara, São Gonçalo - RJ, 24710-392, Brazil",
"Casa de Bolos São Gonçalo, RJ","R. Cel. Moreira César, 7 Centro - Ze Garoto, São Gonçalo - RJ, 24440-400, Brazil",
Espaço Gourmet - Peixaria Moderna,"Av. Jorn. Roberto Marinho, 231 - Colubandê, São Gonçalo - RJ, 24451-045, Brazil",
The Sao Goncalo,"Rua Yolanda Saad Abuzaid, 150 - Grupo 917 - Alcantara, São Gonçalo - RJ, 24710-460, Brazil",
Meraki tortas e salgados,"Av. Paula Lemos, 17 - Mutua, São Gonçalo - RJ, 24461-000, Brazil",
Loja Point da Mari,"R. Cap. Acácio, 1379 - Boaçu, São Gonçalo - RJ, 24467-110, Brazil",
Atacadão - Manilha,"Rua Oliveira Botelho, 349 ((Prox, Rod. Niterói - Manilha - Neves, São Gonçalo - RJ, 24425-005, Brazil",
Supermercados Guanabara,"Av. Jorn. Roberto Marinho, 221 - Mutondo, São Gonçalo - RJ, 24451-715, Brazil",
Natural Gourmet - Guanabara,"Av. Jorn. Roberto Marinho, 221 - Loja 209 e 210 - Mutondo, São Gonçalo - RJ, 24451-715, Brazil",
Irmãos Da Terra,"R. Dr. Felíciano Sodré, 57 - Loja 5 - Rodo, São Gonçalo - RJ, 24440-440, Brazil",
Cosmétika Carioca,"R. Honório Ferreira, 956 - Colubandê, São Gonçalo - RJ, 24451-490, Brazil",
Mundo Verde Carrefour Alcantara,"R. Dr. Alfredo Backer, 500 - Loja 4 e 5 - Alcantara, São Gonçalo - RJ, 24452-005, Brazil",
Primus Produtos Naturais,"Av. Domingos Damasceno Duarte, 732 - Loa 101 - Trindade, São Gonçalo - RJ, 24456-422, Brazil",
"Qamar Lanchonete, Sorvetes e Cafeteria","R. Cel. Rodrigues, 442 - loja 01 - Centro, São Gonçalo - RJ, 24440-460, Brazil",
Perfumaria Kennedy,"Av. Pres. Kennedy, 339 - Centro, São Gonçalo - RJ, 24445-000, Brazil",
CEASA,"R. Cap. Juvenal Figueiredo, 1406 - Colubandê, São Gonçalo - RJ, 24744-560, Brazil",
ZÉ GAROTÃO - Produtos para Sorveterias e Confeitarias,"TERREO - CEASA - R. Cap. Juvenal Figueiredo, 1406 - PAVILHAO G - Colubandê, São Gonçalo - RJ, 24753-560, Brazil",
D&D Cosméticos,"Av. Dezoito do Forte, 27 - loja 14 - Centro, São Gonçalo - RJ, 24460-005, Brazil",
Atacadão - São Gonçalo,"Av. Jorn. Roberto Marinho, 407 - Alcantara, São Gonçalo - RJ, 24451-715, Brazil",
Carioca Grãos & temperos,"Av. Eugênio Borges, 4400 - Rio do Ouro, São Gonçalo - RJ, 24752-290, Brazil",
Casas Verde Produtos Naturais,"R. Dr. Nilo Peçanha, 56 - Loja 78 - Centro, São Gonçalo - RJ, 24445-360, Brazil",
Perfumaria Kennedy,"RJ, Estr. Raul Veiga, 274 - Alcantara, São Gonçalo - RJ, 24710-480, Brazil",
JJDistribuição de suplementos naturais,"Av. Santa Catarina, 84 - Lote 14. Quadra - Jardim Catarina, São Gonçalo - RJ, 24717-140, Brazil",
Gran Maché Mercado,"Av. José Mendonça de Campos, 6 - Colubandê, São Gonçalo - RJ, 24451-715, Brazil",
D&D Cosméticos,"Rua Yolanda Saad Abuzaid, 51 - loja 120 - Alcantara, São Gonçalo - RJ, 24710-460, Brazil",
Distribuidora de Bananas Marilúcia,"R. Itacolomi, 409 - Jardim Catarina, São Gonçalo - RJ, 24715-562, Brazil",
Chiquita Banana,"Rua Capitão Juvenal Figueiredo 1046 Ceasa Pavilhão H Box 36 - Colubandê, São Gonçalo - RJ, 24744-560, Brazil",
Casa da Banana,"Jardim Catarina, São Gonçalo - State of Rio de Janeiro, 24717-170, Brazil",
São Gonçalo Shopping,"Rod. Niterói - Manilha, 100 - Boa Vista, São Gonçalo - RJ, 24466-970, Brazil",
Caju,"Caju, Rio de Janeiro - State of Rio de Janeiro, Brazil",
Atacadão - São Gonçalo,"Av. Jorn. Roberto Marinho, 407 - Alcantara, São Gonçalo - RJ, 24451-715, Brazil",
Atacadão Saara,"R. Cap. Juvenal Figueiredo, 14 - Colubandê, São Gonçalo - RJ, 24744-560, Brazil",
JJ ATACADO,"Av. Padre Viêira, 640-704 - Jardim Catarina, São Gonçalo - RJ, 24715-160, Brazil",
Assaí Atacadista,"Av. Pres. Kennedy, 429 - Centro, São Gonçalo - RJ, 24445-000, Brazil",
Atacadão of Trailer,"R. Francisco Portela, 2386 - Parada Quarenta, São Gonçalo - RJ, 24435-000, Brazil",
Atacado E Varejo,"R. Francisco Portela, 2378 - Patronato, São Gonçalo - RJ, 24435-005, Brazil",
Atacadão Posto 13,"Partage Shopping, Av. Pres. Kennedy, 425 - Loja 4002, 4. Andar - Centro, São Gonçalo - RJ, 24445-000, Brazil",
Assaí Atacadista,"R. Dr. Alberto Torres, S/N - Porto Velho, São Gonçalo - RJ, 24426-435, Brazil",
Assaí Atacadista,"Av. Fued Moisés, 114 - Tribobó, São Gonçalo - RJ, 24755-030, Brazil",
Mikro Atacado e Distribuidor - CEASA,"R. Cap. Juvenal Figueiredo 1406, Pav. B, Boxe 31 à 40, Ceasa - Colubandê, São Gonçalo - RJ, 24744-560, Brazil",
Didanda | Moda Feminina | Atacado e Varejo | Plus Size,"R. Luís Gama, 148 - Vista Alegre, São Gonçalo - RJ, 24725-330, Brazil",
Atacaderj Ceasa,"Rua Capitão Juvenal Figueiredo, 1406 Loja Atacaderj - Colubandê, São Gonçalo - RJ, 24744-560, Brazil",
Florplan Atacadista,"R Prof Adalberto Nicoll, 115 - Estrela do Norte, São Gonçalo - RJ, 24445-640, Brazil",
Shopping das Fábricas UM76,"R. Vicente de Lima Cleto - Pião, São Gonçalo - RJ, 24461-561, Brazil",
Picolé Atacado E Varejo,"R. Felinto Macedo, 83 - Alcantara, São Gonçalo - RJ, 24710-210, Brazil",
M do Brasil - Atacado e Brinquedos,"BR-101, km 303 - Guaxindiba, São Gonçalo - RJ, 24722-500, Brazil",
Assaí Atacadista,"Estr. Raul Veiga, 243 - Alcantara, São Gonçalo - RJ, 24736-010, Brazil",
Atacadão TOP Burguer,"Av. Domingos Damasceno Duarte, 941 - Trindade, São Gonçalo - RJ, 24456-422, Brazil",
Nobreza Atacado e Varejo,"Rua Capitão Juvenal Figueiredo 1406, Pavilhão K, Box 10 - Colubandê, São Gonçalo - RJ, 24744-560, Brazil",
Jardel Atacadão,"R. Laureano Rosa, 180 - Alcantara, São Gonçalo - RJ, 24710-350, Brazil",
Supermercados Guanabara,"Av. Jorn. Roberto Marinho, 221 - Mutondo, São Gonçalo - RJ, 24451-715, Brazil",
Supermarket John,"R. Itororó, 1049 - Jardim Catarina, São Gonçalo - RJ, 24715-220, Brazil",
Assaí Atacadista,"Av. Pres. Kennedy, 429 - Centro, São Gonçalo - RJ, 24445-000, Brazil",
Assaí Atacadista,"R. Dr. Alberto Torres, S/N - Porto Velho, São Gonçalo - RJ, 24426-435, Brazil",
Publix Paraíso,"R. Francisco Portela, 89 - Paraíso, São Gonçalo - RJ, 24435-001, Brazil",
Supermarkets Grand Marché,"R. Abílio José de Mattos, 1083 - Porto da Pedra, São Gonçalo - RJ, 24436-000, Brazil",
Mercado Hawair,"Lote 4 quadra 165, Av. Dr. Albino Imparato - Jardim Catarina, São Gonçalo - RJ, 24716-454, Brazil",
Atacadão - Manilha,"Rua Oliveira Botelho, 349 ((Prox, Rod. Niterói - Manilha - Neves, São Gonçalo - RJ, 24425-005, Brazil",
Supermarket Porto Velho,"R. Cmte. Ari Parreiras, 25 - Porto Velho, São Gonçalo - RJ, 24430-000, Brazil",
Supermarkets Grand Marché,"R. Salvatori, 541 - Rocha, São Gonçalo - RJ, 24421-300, Brazil",
Supermarket,"R. Cap. João Manoel, 1447 - Porto Novo, São Gonçalo - RJ, 24435-550, Brazil",
Supermarket,"Estr. Raul Veiga, 237 - Vila Três, São Gonçalo - RJ, 24710-480, Brazil",
Supermarket,"Av. Dr. Albino Imparato, 1512 - Lote 18 Qd. 125 - Jardim Catarina, São Gonçalo - RJ, 24716-453, Brazil",
Mercado JC,"R. Dr. Pio Borges, 231 - Covanca, São Gonçalo - RJ, 24425-000, Brazil",
Atacadão - São Gonçalo,"Av. Jorn. Roberto Marinho, 407 - Alcantara, São Gonçalo - RJ, 24451-715, Brazil",
Carrefour Hypermarket Alcantara,"R. Dr. Alfredo Backer, 500 - Alcantara, São Gonçalo - RJ, 24452-001, Brazil",
Supermarkets Grand Marché,"Av. José Mendonça de Campos, 1224 - Colubandê, São Gonçalo - RJ, 24451-001, Brazil",
Mercado Noroeste,"R. Cap. Acácio, 161 - Boaçu, São Gonçalo - RJ, 24467-110, Brazil",
Supermercado Galo Branco,"R. Guilherme Santos Andrade, 295 - Galo Branco, São Gonçalo - RJ, 24422-330, Brazil",
Supermarket,"Av. Dr. Eugênio Borges, 938 - Arsenal, São Gonçalo - RJ, 24755-110, Brazil",
Empório Vírgula,"R. Carlos Gianelli, 235 - Boaçu, São Gonçalo - RJ, 24465-000, Brazil",
Empório São Pedro,"Estr. São Pedro, 1855 - Vista Alegre, São Gonçalo - RJ, 24725-270, Brazil",
World of Events,"R. João de Souza, 20 - Centro, São Gonçalo - RJ, 24445-370, Brazil",
Cheirin Bão,"R. Dr. Felíciano Sodré, 141 - Loja A - Centro, São Gonçalo - RJ, 24440-440, Brazil",
Lojas Competição - São Gonçalo LJ06,"R. Dr. Felíciano Sodré, 226 - Centro, São Gonçalo - RJ, 24440-460, Brazil",
Citycol São Gonçalo,"R. Dr. Felíciano Sodré, 245 - Centro, São Gonçalo - RJ, 24440-440, Brazil",
Cores de Minas São Gonçalo,"Rua Feliciano Sodré n35, R. Dr. Felíciano Sodré, 35 - Loja 8 - Centro, São Gonçalo - RJ, 24440-440, Brazil",
Pés & Patas Centro São Gonçalo,"R. Dr. Nilo Peçanha, 34 - Centro, São Gonçalo - RJ, 24445-360, Brazil",
pg* ton trailler do São Gonçalo,"Centro, São Gonçalo - State of Rio de Janeiro, 24440-440, Brazil",
Empório C&B,"R. Moreira Façanha, 328-372 - Rocha, São Gonçalo - RJ, 24421-300, Brazil",
Atacadão - São Gonçalo,"Av. Jorn. Roberto Marinho, 407 - Alcantara, São Gonçalo - RJ, 24451-715, Brazil",
Empório Embalagens e Festas,"R. Cmte. Ari Parreiras, 1086 - Porto Velho, São Gonçalo - RJ, 24430-192, Brazil",
1001 Sapatilhas São Gonçalo,"R. Dr. Felíciano Sodré, 195 - lj 4 - Centro, São Gonçalo - RJ, 24440-440, Brazil",
Lojas Competição - São Gonçalo LJ05,"Av. Pres. Kennedy, 479 - Centro, São Gonçalo - RJ, 24445-000, Brazil",
Cresci e Perdi - São Gonçalo,"R. João de Souza, 134 - Centro, São Gonçalo - RJ, 24445-370, Brazil",
Armazém das Tintas - São Gonçalo | Pinturas | Cores Personalizadas | Acabamento | Tintas e Acessórios,"R. José Lourenço de Azevedo, 141 - Rocha, São Gonçalo - RJ, 24421-300, Brazil",
"Lojas Steel Home: Placa, Gesso e Forro em São Gonçalo RJ","Av. Gov. Macedo Soares, 3054 - Porto da Pedra, São Gonçalo - RJ, 24436-225, Brazil",
Kalunga,"Partage Shopping - Av. Pres. Kennedy, 425 - Centro, São Gonçalo - RJ, 24445-000, Brazil",
Rede Varejão Hortifruti - São Gonçalo | Hortifruti São Gonçalo | Delivery | Loja 2,"Rodo - R. Dr. Nilo Peçanha, 30 - Loja 2 - Centro, São Gonçalo - RJ, 24445-300, Brazil",
Global Music Shop - Loja de Instrumentos Musicais em São Gonçalo,"Av. Pres. Kennedy, 404 - Rodo, São Gonçalo - RJ, 24445-000, Brazil",
Depósito do Serginho,"R. Cel. Joaquim Ramos - Gradim, São Gonçalo - RJ, 24431-230, Brazil",
Forte das Bebidas,"R. Joaquim Laranjeiras, 818 - Lagoinha, São Gonçalo - RJ, 24731-071, Brazil",
Embraza Bebidas,"R. Alfredo Gameiro - Porto do Rosa, São Gonçalo - RJ, 24472-012, Brazil",
Portuga´s Bar,"R. José Lourenço de Azevedo, 21 - Loja 05 - Rocha, São Gonçalo - RJ, 24421-300, Brazil",
Mané São Gonçalo,"Av. Pres. Kennedy, 425 - Centro, São Gonçalo - RJ, 24445-000, Brazil",
Embraza Mercado de Bebidas,"R. Abílio José de Mattos, 1010 - Porto da Pedra, São Gonçalo - RJ, 24436-000, Brazil",
Jr Depósito De Bebidas,"R. Laureano Rosa, 172 - Alcantara, São Gonçalo - RJ, 24710-350, Brazil",
Lekin Licor,"Av. Carlos Mariguella - Praia de Itaipuaçu, Maricá - RJ, 24936-730, Brazil",
Depósito da Lili,"Estr. de Guaxindiba, 392 - Vista Alegre, São Gonçalo - RJ, 24722-030, Brazil",
Bar do Yoda,"R. Eng. Bernardo Sayão, 500 - Sobrado - Jardim Catarina, São Gonçalo - RJ, 24717-242, Brazil",
Bar e Depósito do Berreco,"Av. Prof. Josué de Castro, 39 - Porto do Rosa, São Gonçalo - RJ, 24470-000, Brazil",
Karioca Ginkeria & Sushi Bar,"Av. Jorn. Roberto Marinho, 100 - Mutondo, São Gonçalo - RJ, 24450-265, Brazil",
Alô Boteco,"R. Abílio José de Mattos, 430 - Porto da Pedra, São Gonçalo - RJ, 24436-055, Brazil",
Baruc Açaiteria Artesanal,"R. Clodomiro Antunes da Costa, 60 - Arsenal, São Gonçalo - RJ, 24751-360, Brazil",
Baruc Açaiteria Artesanal,"Av. Abdias José dos Santos, 9409 - Rio do Ouro, São Gonçalo - RJ, 24756-151, Brazil",
Baruc Açaiteria - Unidade Santa Luzia SG,"Av. Alzira Vargas, 213 - Santa Luzia, São Gonçalo - RJ, 24736-190, Brazil",
SamBar Petiscaria,"R. Salvatori, 431 - Centro, São Gonçalo - RJ, 24421-005, Brazil",
Boaçu,"Boaçu, São Gonçalo - State of Rio de Janeiro, Brazil",
Barracão,"Barracão, São Gonçalo - State of Rio de Janeiro, Brazil",
Bartô Galático São Gonçalo,"Av. Pres. Kennedy, 425 - Loja 116 - Centro, São Gonçalo - RJ, 24445-000, Brazil",
São Gonçalo,"São Gonçalo, State of Rio de Janeiro, Brazil",
São Gonçalo,"São Gonçalo - State of Rio de Janeiro, Brazil",
Ilê Iputi Babá Barú,"Tv. Santa Rita - Lindo Parque, São Gonçalo - RJ, 24420-450, Brazil",
Obah! Bar & Ginkeria,"R. Francisco Portela, 2534 - Centro, São Gonçalo - RJ, 24435-005, Brazil",
Baru Rio,"Estr. do Pontal, 7230 - Recreio dos Bandeirantes, Rio de Janeiro - RJ, 22790-877, Brazil",
Baruki Eventos,"R. Paulo Barreto, 916 - Laranjal, São Gonçalo - RJ, 24720-010, Brazil",
BAURUCAS - SÃO GONÇALO,"Av. São Gonçalo, 100 - Boa Vista, São Gonçalo - RJ, 24466-970, Brazil",
Sandubas Sanduíches Naturais e Sucos,"Av. Domingos Damasceno Duarte, 308 - Trindade, São Gonçalo - RJ, 24456-422, Brazil",
Cosechas Pátio Alcântara,"R. Dr. Alfredo Backer, 632 - Alcantara, São Gonçalo - RJ, 24710-392, Brazil",
"Qamar Lanchonete, Sorvetes e Cafeteria","R. Cel. Rodrigues, 442 - loja 01 - Centro, São Gonçalo - RJ, 24440-460, Brazil",
Mais Sucos,"R. Jaime de Figueiredo, 1899 - Patronato, São Gonçalo - RJ, 24435-260, Brazil",
Saudável Sucos,"Estrada Vereador Luiz Carlos, 596 - Área A4, Estr. Ver. Luiz Carlos Silva, 584 - Galo Branco, São Gonçalo - RJ, 24422-170, Brazil",
Sucomarisol,"Rua Yolanda Saad Abuzaid, 109 - Loja 4 - Alcantara, São Gonçalo - RJ, 24710-460, Brazil",
AJ Crepes E Tapiocas,"R. Dr. Alberto Torres - Vila Lage, São Gonçalo - RJ, 24426-260, Brazil",
Cerino café,"R. Cap. Juvenal Figueiredo, 55 - loja 2 - Coelho, São Gonçalo - RJ, 24740-081, Brazil",
Espaço Vida Saudável,"Shopping 321 - Sala - 09, Av. Pres. Kennedy, 321 - Centro, RJ, 24490-490, Brazil",
Tropical Mix,"Partage Shopping São Gonçalo - Av. Pres. Kennedy, 425 - Loja 401 - Centro, São Gonçalo - RJ, 24445-000, Brazil",
Cantina Nuestro,"R. Clodoaldo dos Reis, 90 - Loja 1 - Raul Veiga, São Gonçalo - RJ, 24710-510, Brazil",
Cantinho da Ilma - Só Vitória,"Rod. Amaral Peixoto, Km 6 - Tribobó, São Gonçalo - RJ, 24750-610, Brazil",
Empório Vírgula,"R. Carlos Gianelli, 235 - Boaçu, São Gonçalo - RJ, 24465-000, Brazil",
D'De Açaí e Lanches,"R. Américo Salvatori, 31 - Rocha, São Gonçalo - RJ, 24420-500, Brazil",
Cheirin Bão,"R. Dr. Felíciano Sodré, 141 - Loja A - Centro, São Gonçalo - RJ, 24440-440, Brazil",
Cosechas Shopping São Gonçalo,"Av. São Gonçalo, 100 - Boa Vista, São Gonçalo - RJ, 24466-315, Brazil",
Invictos Burger - Hamburgueria São Gonçalo Artesanal,"Praça da Trindade - Praça Leonor Corrêa, 05 - Trindade, São Gonçalo - RJ, 24457-010, Brazil",
Triunfo lanchonete e restaurante Ltda.,"R. Cmte. Ari Parreiras, 2051 - Porto Velho, São Gonçalo - RJ, 24430-000, Brazil",
Justo Café Centro SG,"R. Salvatori, 10 - Centro, São Gonçalo - RJ, 24421-005, Brazil",
Rodobier,"R. Salvatori, 15 - Centro, São Gonçalo - RJ, 24421-005, Brazil",
Delli-Veggie Cesta Orgânica RJ - Cesta Agroecológica,"R. Antônio Gonçalves Dias, 213 - Porto Novo, São Gonçalo - RJ, 24435-820, Brazil",
Irmãos Da Terra,"R. Dr. Felíciano Sodré, 57 - Loja 5 - Rodo, São Gonçalo - RJ, 24440-440, Brazil",
Filex Casa das Ervas,"R. Nestor Pinto Alves, 34 - lj 60 - Alcantara, São Gonçalo - RJ, 24711-070, Brazil",
Natural Gourmet - Guanabara,"Av. Jorn. Roberto Marinho, 221 - Loja 209 e 210 - Mutondo, São Gonçalo - RJ, 24451-715, Brazil",
Sem Dúvida Produtos Naturais,"R. João Caetano, 369 - Loja 3 - Alcantara, São Gonçalo - RJ, 24410-450, Brazil",
Renasça Alimentação Saudável,"R. Manoel João Gonçalves, 206 - Alcantara, São Gonçalo - RJ, 24711-080, Brazil",
Feirinha In Home,"Av. Dezoito do Forte, 1 - Centro, São Gonçalo - RJ, 24460-005, Brazil",
Pró-Bio Ateliê,"R. Cap. Juvenal Figueiredo, 2005 - ap 506 - Colubandê, São Gonçalo - RJ, 24744-560, Brazil",
Cheiro Verde,"R. Carlos Gianelli, 401 - Lj 3 - Centro, São Gonçalo - RJ, 24465-000, Brazil",
Casas Verde Produtos Naturais,"R. Dr. Nilo Peçanha, 56 - Loja 78 - Centro, São Gonçalo - RJ, 24445-360, Brazil",
Viva Verde,"R. Dr. Nilo Peçanha, 11 - Centro, São Gonçalo - RJ, 24440-300, Brazil",
Energia Ativa Naturais e Suplementos,"R. Dalva Raposo, 550 - Lote 12 - Loja 2 - Tribobó, São Gonçalo - RJ, 24754-190, Brazil",
Primus Produtos Naturais,"Av. Domingos Damasceno Duarte, 732 - Loa 101 - Trindade, São Gonçalo - RJ, 24456-422, Brazil",
Microverdes da Igreja,"R. Abílio José de Mattos, 1.349 - casa 35 - Porto da Pedra, São Gonçalo - RJ, 24436-105, Brazil",
natural do biju,"Av. Dr. Albino Imparato, 1041 - Jardim Catarina, São Gonçalo - RJ, 24716-450, Brazil",
Armazém do Bem - Produtos Naturais & Suplementos,"Estr. Raul Veiga, 351 - Loja 27 - Alcantara, São Gonçalo - RJ, 24710-480, Brazil",
Estilo ZOE - Produtos Naturais e Suplementos Alimentares,"Av. Paula Lemos, 425 - Mutua, São Gonçalo - RJ, 24461-000, Brazil",
Egipiciana,"Av. Dezoito do Forte, 416 - Loja 1 - Mutua, São Gonçalo - RJ, 24460-005, Brazil",
Mundo Verde Carrefour Alcantara,"R. Dr. Alfredo Backer, 500 - Loja 4 e 5 - Alcantara, São Gonçalo - RJ, 24452-005, Brazil",
Natural cosmetico,"Estrada da Lagoinha, 56 - Pacheco, São Gonçalo - RJ, 24731-223, Brazil",
LTDA,"Av. Fued Moisés, 373 - Lote 05 - Arsenal, São Gonçalo - RJ, 24755-030, Brazil",
Cia dos Salgadinhos - São Gonçalo,"R. Alberto Santos Lima, 123 - Boaçu, São Gonçalo - RJ, 24467-245, Brazil",
Lúpulo FC - Fábrica,"AvenidaTrindade, 790 - Trindade, São Gonçalo - RJ, 24456-420, Brazil",
"Farmácia e Drogaria Cristal - Centro, São Gonçalo","Entrega (21) 99534-8054 - R. Dr. Nilo Peçanha, 08 - Centro, São Gonçalo - RJ, 24445-300, Brazil",
Cristal ME.,"Rua Juazeiro Qd173 - Trindade, São Gonçalo - RJ, 24456-210, Brazil",
Farmácia e Drograria Cristal São Gonçalo 2,"ENTREGAS (21) 99551-5001, Av. Pres. Kennedy, 399 - Centro, São Gonçalo - RJ, 24445-000, Brazil",
Cristal Mix,"rua expedicionário, R. José Belford Filho - Jóquei Clube, São Gonçalo - RJ, 24745-330, Brazil",
Upper Car Estética Automotiva,"R. Imboassú, 32 - Boaçu, São Gonçalo - RJ, 24465-220, Brazil",
Drogaria Cristal Alcântara,"Whatsapp:(21) 98927-3145, __R. Manoel João Gonçalves, 414 - Vila Três, São Gonçalo - RJ, 24711-080, Brazil",
Cristal distribuidora de bebidas,"R. Carlos Gianelli, 257 - 8 - Centro, São Gonçalo - RJ, 24465-000, Brazil",
Salão de Festas Cristal,"R. Abílio José de Mattos, 918 - Porto da Pedra, São Gonçalo - RJ, 24436-000, Brazil",
Salão Cristal Porto Da Pedra.,"R. Minas Gerais, 12 - Brasilândia, São Gonçalo - RJ, 24465-280, Brazil",
EMBRASIL EMBALAGENS,"R. Cap. Juvenal Figueiredo, 495 - Almerinda, São Gonçalo - RJ, 24744-560, Brazil",
CMG Estética Automotiva,"R. Severino Magalhães, 32 - Rocha, São Gonçalo - RJ, 24422-085, Brazil",
F Guerreiro,"Av. São Miguel, 1034 - São Miguel, São Gonçalo - RJ, 24445-686, Brazil",
Passarela,"Lote 13A, Loja 02, R. Visc. de Mauá, S/N - Santa Luzia, São Gonçalo - RJ, 24722-235, Brazil",
Refrigerantes Mineirinho e Flexa,"R. Clóvis Bevilacqua, 285 - Barro Vermelho, São Gonçalo - RJ, 24415-560, Brazil",
Guaramor,"R. Francisco Portela, 2649 - Porto Novo, São Gonçalo - RJ, 24435-001, Brazil",
DISTRIBUIDORA CALIFÓRNIA,"R. Antônio Menezes, 198 - Jardim California, São Gonçalo - RJ, 24465-195, Brazil",
ZÉ GAROTÃO - Produtos para Sorveterias e Confeitarias,"TERREO - CEASA - R. Cap. Juvenal Figueiredo, 1406 - PAVILHAO G - Colubandê, São Gonçalo - RJ, 24753-560, Brazil",
I9 ATACADÃO,"Av. Humberto de Alencar Castelo Branco, 3315 - Rocha, São Gonçalo - RJ, 24420-075, Brazil",
Cia do Doce,"Av. Dezoito do Forte, 486 - Mutua, São Gonçalo - RJ, 24460-000, Brazil",
Empório Vírgula,"R. Carlos Gianelli, 235 - Boaçu, São Gonçalo - RJ, 24465-000, Brazil",
Rainha Supermercados - Mercado em São Gonçalo,"Av. Joaquim de Oliveira, 617 - Boa Vista, São Gonçalo - RJ, 24465-531, Brazil",
Atacadão - São Gonçalo,"Av. Jorn. Roberto Marinho, 407 - Alcantara, São Gonçalo - RJ, 24451-715, Brazil",
Mercado Delatorre,"R. Francisco Barbeiro, 485 - Boaçu, São Gonçalo - RJ, 24460-490, Brazil",
Magatão Açai,"Av. Jorn. Roberto Marinho, 2116 - Alcantara, São Gonçalo - RJ, 24451-010, Brazil",
Restaurante Alleato - São Gonçalo | Churrasco | Pizzaria | Grill | Selv-Service | Delivery,"R. José Lourenço de Azevedo, 181 - Rocha, São Gonçalo - RJ, 24421-300, Brazil",
